Timestamp,Question,Context,Context Precision,Context Recall
2024-11-15 15:54:00,"LOCATION: Willowdale East
    
    SAFETY CONCERNS:
    - Assault: High, Auto Theft: Moderate, Robbery: Low
    
    ADDITIONAL USER CONTEXT:
    Q: What is your relationship with this neighbourhood?"",
A: I have recently moved here for work."",
Q: Have you witnessed or been a victim of these crimes before?"",
A: No, I have not but I have heard about them from neighbours."",
Q: Are there specific times or places where you feel more at risk?"",
A: I feel more at risk during late hours and in the park nearby.","['![City of Toronto](https://www.toronto.ca/wp-content/themes/cot/img/logo-print.svg)\n\n# Your Personal Safety Checklist\n\nHere are some questions to help you explore your personal safety. Just to make it easy, you should be answering yes to all of the following questions. If you answer no, have a closer look at the item to see if that is really how you wish to handle the situation.\n\nAt Home', '![City of Toronto](https://www.toronto.ca/wp-content/themes/cot/img/logo-print.svg)\n\n# Your Personal Safety Checklist\n\nHere are some questions to help you explore your personal safety. Just to make it easy, you should be answering yes to all of the following questions. If you answer no, have a closer look at the item to see if that is really how you wish to handle the situation.\n\nAt Home', '- Create gathering areas at locations with natural surveillance and access control\n\n- Re-designate the use of space to provide natural barriers to conflicting activities\n\n- Improve scheduling of space to allow for effective use(parking for night shift workers closest to the building)\n\n- Overcome distance and isolation through improved communications\n\n- Place safe activities in vulnerable areas, e.g. community garden in vacant land\n\n- Place vulnerable activities in a safe place, e.g. kindergarten play area in school courtyard\n\n- Increase the perception of natural surveillance, especially around access control points\n\n\nTo report a crime anonymously, call Crime Stoppers at: 1-800-222-8477(TIPS) or online at: [www.222tips.com](http://222tips.com)\n\nIn An Emergency: Call 9-1-1.\n\nTo report a crime to the Toronto Police that is not an emergency call\xa0416-808-2222.\n\n## More Updates\n\n* * *', '## Home Safety Starts With You\n\n**Detection in Your Neighbourhood**\n\n* * *\n\n- Keep your ears and eyes open for suspicious vehicles and people around your home\n- Do not confront possible suspects\n- Record the license plate numbers and description of suspicious vehicles\n- Record detailed descriptions of occupants of suspicious vehicles\n- Report your concerns and observations immediately to the Police\n\n**Reducing Your Risk**\n\n* * *', '* * *\n\n- Give the babysitter a tour of your home and be sure to review your escape plan, pointing out marked exits, any potential hazards and areas that are off limits.\n\n- Make it clear to the babysitter that if there is smoke or fire, your only concern is that everyone is out of the house quickly and safely.\n\n- Emergency telephone numbers to the babysitter and provide them with an emergency contact sheet.\n\n- Ensure you have an emergency first aid kit and show the babysitter where it’s stored.\n\n\nTo report a crime anonymously, call Crime Stoppers at: 1-800-222-8477(TIPS) or online at: [www.222tips.com](http://222tips.com)\n\nIn An Emergency: Call 9-1-1.\n\nTo report a crime to the Toronto Police that is not an emergency call\xa0416-808-2222.\n\n## More Updates\n\n* * *\n\n[![](/media/filer_public_thumbnails/filer_public/f8/ce/f8ced020-9f7b-4059-8d7e-6220d7e9d97a/c248844b-cd1e-431c-8ff9-5bced8e3cb62.jpg__630x300_q85_crop_subsampling-2_upscale.jpg)](/crime-prevention/frauds-against-seniors/)']",0.4166666666458333,0.3
